{
  "$schema": "https://json-schema.org/draft/2020-12/schema",
  "$id": "https://aoa.local/aoa-agents/schemas/assistant_office_live_profile_v1.json",
  "title": "Assistant Office Live Profile V1",
  "type": "object",
  "additionalProperties": false,
  "required": [
    "created_at",
    "evidence_refs",
    "evolution_mode",
    "id",
    "kind",
    "mandate",
    "notes",
    "office_id",
    "owner_repo",
    "status",
    "version"
  ],
  "properties": {
    "created_at": {
      "type": "string",
      "minLength": 1,
      "format": "date-time"
    },
    "evidence_refs": {
      "type": "array",
      "items": {
        "type": "string",
        "minLength": 1
      },
      "minItems": 1
    },
    "evolution_mode": {
      "type": "string",
      "minLength": 1
    },
    "id": {
      "type": "string",
      "minLength": 1
    },
    "kind": {
      "type": "string",
      "minLength": 1,
      "const": "assistant_office_live_profile_v1"
    },
    "mandate": {
      "type": "string",
      "minLength": 1
    },
    "notes": {
      "type": "string",
      "minLength": 1
    },
    "office_id": {
      "type": "string",
      "minLength": 1
    },
    "owner_repo": {
      "type": "string",
      "minLength": 1,
      "const": "aoa-agents"
    },
    "status": {
      "type": "string",
      "minLength": 1,
      "enum": [
        "active",
        "allowed",
        "applied",
        "blocked",
        "completed",
        "draft",
        "failed",
        "held",
        "passed",
        "proposed",
        "rejected",
        "rolled_back",
        "sealed"
      ]
    },
    "version": {
      "type": "string",
      "minLength": 1,
      "const": "1.1.0"
    }
  }
}
