{
  "created_at": "2026-04-22T00:00:00Z",
  "evidence_refs": [
    "generated/multi_office_train_clean_flow/release_train.json"
  ],
  "evolution_mode": "exogenous_reactive",
  "id": "assistant_office_live_profile_v1_example",
  "kind": "assistant_office_live_profile_v1",
  "mandate": "watch, alarms, incident surfacing, escalation",
  "notes": "Example artifact for assistant_office_live_profile_v1.",
  "office_id": "monitor.assistant",
  "owner_repo": "aoa-agents",
  "status": "draft",
  "version": "1.1.0"
}